{
  "schema_version": "1.0",
  "event_id": "evt-000002",
  "event_type": "correction",
  "scene_id": "scene-0001",
  "sequence": 2,
  "supersedes": ["evt-000001"],
  "reason": "Extraction correction (Case A): inventory item label restated as full replacement deltas after superseding evt-000001. Reuses the same approved manuscript, manuscript_hash, and approval_id — prose bytes were unchanged; only the extracted state deltas were wrong.",
  "story_time": {
    "date": "voyage-year-14-day-220",
    "time": "09:15"
  },
  "provenance": {
    "manuscript": "manuscript/scenes/scene-0001.md",
    "manuscript_hash": "sha256:96d510371975c4627bc5ec407f01fab8b544d4efae7a0dc0b978c0bb48843bd9",
    "approval_id": "apr-000001",
    "scene_card": "planning/scenes/scene-0001.yaml"
  },
  "changes": {
    "characters": {
      "sera-voss": {
        "location": "medbay",
        "relationships": {
          "marcus-hale": "growing suspicion"
        }
      },
      "marcus-hale": {
        "location": "medbay",
        "relationships": {
          "sera-voss": "reluctant cooperation"
        }
      }
    },
    "threads": {
      "memory-gaps": {
        "state": "advanced",
        "note": "Marcus acknowledges possible memory edit; investigation opened"
      }
    },
    "knowledge": {
      "sera-voss": {
        "knows_added": [
          "Marcus recalls coolant inspection on Tuesday with burnt-sugar smell at ladder three",
          "Marcus's certified log shows impossible timestamp",
          "Marcus admits the record may have been edited",
          "Formal discrepancy investigation opened"
        ],
        "suspects_added": [
          "Someone with archive access altered Marcus's memory log"
        ],
        "does_not_know_removed": [
          "Whether anyone has recently invoked Clause 17 on Marcus"
        ]
      },
      "marcus-hale": {
        "knows_added": [
          "Sera has hash evidence of log corruption",
          "Formal investigation will be filed"
        ],
        "does_not_know_added": [
          "Identity of whoever edited the log"
        ]
      }
    },
    "world": {
      "investigations": {
        "marcus-hale-memory-discrepancy": "open"
      }
    },
    "inventory": {
      "sera-voss": {
        "gained": [
          "private-hash-comparison-note"
        ]
      }
    },
    "timeline": [
      {
        "event_id": "evt-000002",
        "scene_id": "scene-0001",
        "label": "Marcus memory discrepancy interview (corrected inventory label)",
        "story_time": {
          "date": "voyage-year-14-day-220",
          "time": "09:15"
        }
      }
    ]
  }
}
